<!ELEMENT FILM (ENFILM)*>
<!ELEMENT ENFILM (TITTEL, SJANGER?, PRODÅR)>
<!ELEMENT TITTEL (#PCDATA)>
<!ELEMENT SJANGER (#PCDATA)>
<!ELEMENT PRODÅR (#PCDATA)>
<!ATTLIST ENFILM FilmNr CDATA #REQUIRED>
<!ATTLIST ENFILM Sensur CDATA #IMPLIED>